,feature,weight,std
369,Smoked at least 100 cigarettes in life,-0.0006354249404288525,0.0005943856055240168
370,Moderate work activity_2.0,-0.0006354249404288525,0.0005943856055240168
371,How often drank milk age 5-12,-0.0006354249404288525,0.0005943856055240168
372,Self-reported weight-10 yrs ago (pounds),-0.0006354249404288747,0.0007782334369445704
373,Doctor told you - high cholesterol level_2.0,-0.0006354249404288747,0.0007782334369445703
374,How healthy is the diet_2.0,-0.0006354249404288747,0.0007782334369445703
375,Ever told you had chronic bronchitis,-0.0007942811755360379,0.0
376,Main reason for last dental visit,-0.0007942811755360379,0.0
377,Rate the health of your teeth and gums_2.0,-0.0007942811755360379,0.0
378,Limited in amount of work you can do,-0.0007942811755360379,0.0
379,Covered by health insurance_2.0,-0.0007942811755360379,0.0
380,Overnight hospital patient in last year_1.0,-0.0007942811755360379,0.0
381,Ever told you had COPD?,-0.0007942811755360602,0.0005023475234580135
382,MD ever told you had genital herpes (B),-0.0007942811755360602,0.0005023475234580135
383,Do you think you might have gum disease?,-0.0007942811755360602,0.0005023475234580135
384,Limitations keeping you from working,-0.0007942811755360602,0.0005023475234580135
385,How many days use dental floss/device,-0.0007942811755360602,0.0005023475234580135
386,Type of work done last week_1.0,-0.0007942811755360602,0.0005023475234580135
387,Type place most often go for healthcare,-0.0007942811755360824,0.0008700914336856981
388,Doctor told you to reduce salt in diet_1.0,-0.0007942811755360824,0.0007104266806988592
389,Money spent at supermarket/grocery store,-0.0007942811755360824,0.0011232832107808198
390,Time when no insurance in past year?,-0.0007942811755360824,0.0007104266806988592
391,Blood ever tested for HIV virus?,-0.0007942811755360824,0.0007104266806988592
392,Kind of work you have done the longest_2.0,-0.0007942811755360824,0.0007104266806988592
393,Type of work done last week_4.0,-0.0007942811755361045,0.0010046950469160445
394,Last 7-d in other indoor area?_2.0,-0.0007942811755361045,0.0017401828673714265
395,SP have stomach or intestinal illness?,-0.0009531374106432677,0.0003177124702144596
396,Had off-work exposure to loud noise?,-0.0009531374106432677,0.0003177124702144596
397,Have serious difficulty hearing?_1.0,-0.0009531374106432677,0.0003177124702144596
398,How often feel overly sleepy during day?_5.397605346934027e-79,-0.0009531374106432677,0.0003177124702144596
399,Doctor told you - high cholesterol level_1.0,-0.0009531374106432677,0.0003177124702144596
400,# of meals not home prepared,-0.0009531374106432899,0.0012708498808578076
401,Age when heaviest weight,-0.0009531374106433122,0.001366533005090143
402,Stay in the shade?,-0.0009531374106433122,0.0009262830651064465
403,Doctor told you to reduce fat/calories_2.0,-0.0011119936457504975,0.0006354249404289192
404,Avg # alcoholic drinks/day - past 12 mos,-0.0011119936457504975,0.00038911671847231236
405,"Physical, mental, emotional limitations",-0.0011119936457504975,0.00038911671847231236
406,Doctor ever said you were overweight_1.0,-0.0011119936457505198,0.0006354249404288804
407,Routine place to go for healthcare_2.0,-0.0011119936457505198,0.0008100110426676174
408,General condition of hearing_2.0,-0.0011119936457505198,0.0008100110426676174
409,Poor appetite or overeating,-0.0011119936457505198,0.0008100110426676174
410,Have difficulty doing errands alone?_1.0,-0.001111993645750542,0.0012905541548269622
411,Tried to lose weight in past year,-0.0012708498808577274,0.0006354249404289191
412,Leak urine during physical activities,-0.0012708498808577274,0.0006354249404289191
413,How often wear protective hearing device,-0.0012708498808577274,0.00038911671847231236
414,Difficulty these problems have caused,-0.0012708498808577495,0.0006354249404288747
415,# days have 4/5 drinks - past 12 mos,-0.0012708498808577495,0.0009531374106433491
416,Doctor told you to exercise_2.0,-0.0012708498808577495,0.0009531374106433492
417,Kind of work you have done the longest_1.0,-0.001429706115964957,0.0005943856055240642
418,Ever told you had high blood pressure_2.0,-0.001429706115964957,0.0003177124702144596
419,How often have urinary leakage,-0.001429706115964957,0.0005943856055240643
420,When did you last visit a dentist_2.0,-0.001429706115964957,0.0003177124702144596
421,Told benefits of checking blood sugar,-0.001429706115964957,0.0005943856055240642
422,Ever been told of bone loss around teeth,-0.0014297061159649794,0.0012708498808577994
423,How healthy is the diet_4.0,-0.001588562351072187,0.0005023475234580486
424,Last 7-d spent time in another home?_1.0,-0.001588562351072187,0.0007104266806989088
425,Hearing cause frustration when talking?,-0.001588562351072187,0.0005023475234580486
426,Saw nutrition info on restaurant menu,-0.001588562351072187,0.0005023475234580486
427,Ever smoked a cigarette even 1 time?,-0.001588562351072187,0.0005023475234580486
428,Past 30 day milk product consumption_1.0,-0.001588562351072187,0.0007104266806989088
429,Thought you would be better off dead,-0.0017474185861794168,0.0005943856055240642
430,Need special equipment to walk,-0.0017474185861794168,0.0007782334369446247
431,"Ever had vaginal, anal, or oral sex (B)",-0.001747418586179439,0.0010537330549182915
432,Any metal objects inside your body?,-0.002223987291501106,0.000926283065106492
433,How do you consider your weight_1.0,-0.002223987291501106,0.0005943856055240642
434,Urinated before reaching the toilet,-0.002382843526608336,0.001123283210780867
435,Usual wake time on weekdays or workdays,-0.002382843526608336,0.0014208533613978176
436,How many days/mo. exposed to loud noise,-0.002382843526608336,0.0016660982496746045
437,Description of job/work situation,-0.0025416997617155658,0.000926283065106492
438,How worried or anxious were you?,-0.0025416997617155658,0.000926283065106492
439,Doctor ever said you had arthritis,-0.00254169976171561,0.002095457658184707
440,Feeling bad about yourself,-0.0027005559968227956,0.000810011042667648
441,Ever have 4/5 or more drinks every day?,-0.002859412231930025,0.0011887712110481286
